{
  "seq": "1042",
  "id": "m_9c01",
  "linkId": "lnk_3d2a",
  "fromSide": "retail",
  "toSide": "repair",
  "toShopRef": "main",
  "type": "job.new",
  "data": {
    "id": "job_7f3a91c2",
    "tag": "A-1042",
    "customerName": "Pat R",
    "brand": "Bernina",
    "model": "B 570 QE",
    "serial": "001234567",
    "machineType": "Sewing/embroidery",
    "problem": "Skipping stitches",
    "serviceRequested": "Tune-up",
    "accessories": "Foot pedal, hard case",
    "preApprovedCents": 12000,
    "note": null,
    "photos": [
      {
        "mime": "image/jpeg",
        "data": "/9j/4AAQ",
        "caption": "At intake, tag A-1042"
      }
    ],
    "at": "2026-10-29T14:05:00.000Z"
  },
  "createdAt": "2026-10-29T14:05:00.000Z",
  "sig": null
}
